{
  "$schema": "office-baseline.schema.json",
  "schemaVersion": 1,
  "updated": "2026-09-06",
  "producedWith": {
    "libreoffice": "LibreOffice 24.2.7.2 420(Build:2)",
    "poppler": "pdftoppm version 24.02.0",
    "fontSet": "office-fonts-1",
    "platform": "linux",
    "dpi": 144
  },
  "policy": {
    "records": "Only the reads that differ from what LibreOffice made of the same file, and only the renders that do not land in the clean band. Everything this suite exercises that is absent from the two lists below is asserted to agree, so a new difference fails by not being listed.",
    "reproduce": "A row that stops reproducing fails too. That is deliberate: a fix should arrive with this file updated, so the shrinking of the suspected-defect list is a thing somebody can point at. A render that comes back better than the band recorded here fails for the same reason - an improvement nobody records is an improvement nobody can show.",
    "states": "documented - a limitation one of the conformance documents states. suspected-defect - a difference nobody decided on, which is what comparing against another implementation is actually good for. accepted - this component's own behaviour, looked at and accepted.",
    "reviewer": "A row is not classified by being written down. documented and accepted both need a reviewer and a date, and a documented row needs a reference to the conformance document that states the limitation, which the guard checks is really there. This is the same demand CorpusControlGuardTests makes of the corpus baseline and PdfTestControlGuardTests makes of the tool manifest.",
    "toolchain": "producedWith pins the LibreOffice build, the PDF text extractor, the font set, the platform and the dpi these rows were measured on. A run whose own stamp does not match it does not compare against these rows: it skips, and the skip names the mismatch. LibreOffice's layout moves between releases and with whatever fonts it can find, so a row measured on another machine is a claim about that machine, and quietly reading it as a claim about this one is how a suite comes to fail for reasons that have nothing to do with the change under test.",
    "empty": "Both lists ship empty and every producedWith field is null, because nothing has been measured here against an approved, pinned toolchain yet. That is the shipped state on purpose, and it is not the same as having no opinion. An empty file says plainly that nothing has been measured; a file generated against whatever LibreOffice happened to be installed that morning looks like evidence, and would be worse than no baseline for exactly that reason. tests/corpus/external-sources.json ships with no rows on the same argument.",
    "bands": "A render row records bands, not numbers. The numbers under observed are there for a reader, and for hysteresis when a run sits on a threshold; the verdict is the band. Rasterized comparison numbers move with antialiasing, hinting and the version of the font that got installed, so a file that recorded them as the expectation would fail on a change nobody can see and pass on one anybody could.",
    "regenerate": "dotnet run --project src/tests/Broiler.Documents.Office -- --update-baseline"
  },
  "reads": [
    {
      "seed": "headings-and-outline",
      "via": "html",
      "check": "text",
      "differences": [],
      "diagnostics": [
        "html.css.rule"
      ],
      "state": "documented",
      "reference": "docs/notes/html.md",
      "why": "Not a difference at all - the text projections agree, and the row exists only because the read raised html.css.rule. That is the codec reporting that it skipped a stylesheet rule whose selector it does not implement, which here is the 'td p' and 'th p' that LibreOffice writes for a table. Reporting it is the behaviour this component asks of a codec, so the row records a codec doing the right thing loudly. docs/notes/html.md states exactly which selector is matched and which are not, and why the line is drawn there.",
      "reviewer": "Claude Opus 5, on the first office baseline",
      "decided": "2026-09-06"
    },
    {
      "seed": "letterhead-frames",
      "via": "html",
      "check": "text",
      "differences": [],
      "diagnostics": [
        "html.skip.external"
      ],
      "state": "documented",
      "reference": "docs/notes/html.md",
      "why": "Not a difference this component could avoid. LibreOffice's HTML export has no way to write a frame, so it flattens both of the seed's frames to GIF files beside the document and links them; the reader never fetches an external resource and reports html.skip.external once per read, which docs/notes/html.md states outright in both directions. What the row is worth recording for is what it says about the corpus rather than about the codec: the html target of this seed measures a document with the construct taken out of it, so a reader comparing the four targets knows not to read agreement here as evidence about frames.",
      "reviewer": "Claude Opus 5, on the letterhead and line-break seeds",
      "decided": "2026-09-06"
    },
    {
      "seed": "links",
      "via": "html",
      "check": "text",
      "differences": [],
      "diagnostics": [
        "html.css.rule"
      ],
      "state": "documented",
      "reference": "docs/notes/html.md",
      "why": "Not a difference at all - the text projections agree, and the row exists only because the read raised html.css.rule. That is the codec reporting that it skipped a stylesheet rule whose selector it does not implement, which here is the 'td p' and 'th p' that LibreOffice writes for a table. Reporting it is the behaviour this component asks of a codec, so the row records a codec doing the right thing loudly. docs/notes/html.md states exactly which selector is matched and which are not, and why the line is drawn there.",
      "reviewer": "Claude Opus 5, on the first office baseline",
      "decided": "2026-09-06"
    },
    {
      "seed": "lists-nested",
      "via": "docx",
      "check": "interop",
      "differences": [
        "+ libreoffice-of-ours: • nested bullet",
        "+ libreoffice-of-ours: • second nested bullet",
        "+ libreoffice-of-ours: ◦ first bullet",
        "+ libreoffice-of-ours: ◦ second bullet",
        "+ libreoffice-of-ours: ◦ third bullet, back at the outer level",
        "- libreoffice-of-its-own: • first bullet",
        "- libreoffice-of-its-own: • second bullet",
        "- libreoffice-of-its-own: • third bullet, back at the outer level",
        "- libreoffice-of-its-own: ◦ nested bullet",
        "- libreoffice-of-its-own: ◦ second nested bullet"
      ],
      "diagnostics": [],
      "state": "documented",
      "reference": "docs/guides/cli.md",
      "why": "A projection difference rather than a loss, and both projections are right about the same document. LibreOffice's plain-text export writes a list marker into the text - '* first bullet' - and this component's does not, because the bullet is a property of the paragraph rather than a character in it. Both readers saw the same list: the kind and the depth are in dump --as outline and dump --as json, which is where they are readable and comparable. docs/guides/cli.md states the projection's two visible choices and names this as one of them.",
      "reviewer": "Claude Opus 5, on the first office baseline",
      "decided": "2026-09-06"
    },
    {
      "seed": "lists-nested",
      "via": "docx",
      "check": "text",
      "differences": [
        "+ libreoffice: 1. nested ordered one",
        "+ libreoffice: 1. ordered one",
        "+ libreoffice: 2. nested ordered two",
        "+ libreoffice: 2. ordered two",
        "+ libreoffice: • first bullet",
        "+ libreoffice: • second bullet",
        "+ libreoffice: • third bullet, back at the outer level",
        "+ libreoffice: ◦ nested bullet",
        "+ libreoffice: ◦ second nested bullet",
        "- broilerdoc: first bullet",
        "- broilerdoc: nested bullet",
        "- broilerdoc: nested ordered one",
        "- broilerdoc: nested ordered two",
        "- broilerdoc: ordered one",
        "- broilerdoc: ordered two",
        "- broilerdoc: second bullet",
        "- broilerdoc: second nested bullet",
        "- broilerdoc: third bullet, back at the outer level"
      ],
      "diagnostics": [],
      "state": "documented",
      "reference": "docs/guides/cli.md",
      "why": "A projection difference rather than a loss, and both projections are right about the same document. LibreOffice's plain-text export writes a list marker into the text - '* first bullet' - and this component's does not, because the bullet is a property of the paragraph rather than a character in it. Both readers saw the same list: the kind and the depth are in dump --as outline and dump --as json, which is where they are readable and comparable. docs/guides/cli.md states the projection's two visible choices and names this as one of them.",
      "reviewer": "Claude Opus 5, on the first office baseline",
      "decided": "2026-09-06"
    },
    {
      "seed": "lists-nested",
      "via": "html",
      "check": "roundtrip",
      "differences": [
        "paragraph-style@p1: list Bullet vs None",
        "paragraph-style@p2: list Bullet vs None",
        "paragraph-style@p3: list Bullet vs None",
        "paragraph-style@p4: list Bullet vs None",
        "paragraph-style@p5: list Bullet vs None",
        "paragraph-style@p6: list Numbered vs None",
        "paragraph-style@p7: list Numbered vs None",
        "paragraph-style@p8: list Numbered vs None",
        "paragraph-style@p9: list Numbered vs None"
      ],
      "diagnostics": [
        "html.list"
      ],
      "state": "documented",
      "reference": "docs/notes/html.md",